{
  "schemaVersion": "1",
  "caseId": "case-gross-net",
  "currency": "USD",
  "institutions": [
    {
      "institutionId": "institution-a"
    }
  ],
  "accountRefs": [
    {
      "accountRefId": "school-a",
      "kind": "school",
      "institutionId": "institution-a",
      "holderKind": null
    }
  ],
  "terms": [
    {
      "termId": "2026-fall",
      "institutionId": "institution-a",
      "schoolAccountRefId": "school-a",
      "startDate": "2026-08-20",
      "endDateExclusive": "2026-12-21"
    }
  ],
  "aidItems": [
    {
      "aidItemId": "loan-a",
      "institutionId": "institution-a",
      "termId": "2026-fall",
      "recipientKind": "student"
    }
  ],
  "artifacts": [
    {
      "artifactId": "offer-a",
      "sha256": "1111111111111111111111111111111111111111111111111111111111111111",
      "kind": "aid_statement",
      "observedAt": "2026-09-01T09:00:00Z",
      "accountRefId": null
    },
    {
      "artifactId": "disbursement-a",
      "sha256": "2222222222222222222222222222222222222222222222222222222222222222",
      "kind": "aid_disbursement_statement",
      "observedAt": "2026-09-01T10:00:00Z",
      "accountRefId": null
    },
    {
      "artifactId": "school-a-statement",
      "sha256": "3333333333333333333333333333333333333333333333333333333333333333",
      "kind": "school_bill",
      "observedAt": "2026-09-02T09:00:00Z",
      "accountRefId": "school-a"
    }
  ],
  "proposals": [],
  "events": [
    {
      "eventId": "event-offer",
      "parents": [],
      "recordedAt": "2026-09-01T11:00:00Z",
      "kind": "approve_fact",
      "fact": {
        "factId": "offer-a",
        "termId": "2026-fall",
        "accountRefId": null,
        "aidItemId": "loan-a",
        "currency": "USD",
        "role": "aid_offer",
        "recipientKind": null,
        "amountMinor": "100000",
        "proposalId": null,
        "effectiveDate": "2026-09-01",
        "source": {
          "kind": "artifact",
          "artifactId": "offer-a",
          "location": "award:loan-a"
        },
        "reviewId": "review-offer-a"
      }
    },
    {
      "eventId": "event-gross",
      "parents": [
        "event-offer"
      ],
      "recordedAt": "2026-09-02T10:00:00Z",
      "kind": "approve_fact",
      "fact": {
        "factId": "gross-a",
        "termId": "2026-fall",
        "accountRefId": null,
        "aidItemId": "loan-a",
        "currency": "USD",
        "role": "aid_gross_disbursement",
        "recipientKind": null,
        "amountMinor": "100000",
        "proposalId": null,
        "effectiveDate": "2026-09-01",
        "source": {
          "kind": "artifact",
          "artifactId": "disbursement-a",
          "location": "loan:gross"
        },
        "reviewId": "review-gross-a"
      }
    },
    {
      "eventId": "event-posted",
      "parents": [
        "event-gross"
      ],
      "recordedAt": "2026-09-03T10:00:00Z",
      "kind": "approve_fact",
      "fact": {
        "factId": "posted-a",
        "termId": "2026-fall",
        "accountRefId": "school-a",
        "aidItemId": "loan-a",
        "currency": "USD",
        "role": "school_credit",
        "recipientKind": null,
        "amountMinor": "99000",
        "proposalId": null,
        "effectiveDate": "2026-09-01",
        "source": {
          "kind": "artifact",
          "artifactId": "school-a-statement",
          "location": "ledger:loan-a"
        },
        "reviewId": "review-posted-a"
      }
    },
    {
      "eventId": "event-fee",
      "parents": [
        "event-posted"
      ],
      "recordedAt": "2026-09-03T11:00:00Z",
      "kind": "approve_fact",
      "fact": {
        "factId": "fee-a",
        "termId": "2026-fall",
        "accountRefId": null,
        "aidItemId": "loan-a",
        "currency": "USD",
        "role": "aid_fee_withheld",
        "recipientKind": null,
        "amountMinor": "1000",
        "proposalId": null,
        "effectiveDate": "2026-09-01",
        "source": {
          "kind": "artifact",
          "artifactId": "disbursement-a",
          "location": "loan:fee"
        },
        "reviewId": "review-fee-a"
      }
    }
  ]
}
